item.text,m,se,RC1,RC3,RC2
Population growth,5.34,0.07,0.80,0.08,0.19
Carbon dioxide emissions,5.40,0.08,0.79,0.39,0.01
Use of electricity from coal and oil,5.19,0.09,0.77,0.35,-0.03
People heating and cooling their homes,4.69,0.08,0.76,0.26,0.23
People driving their cars,4.94,0.07,0.75,0.42,0.06
Livestock production,4.43,0.08,0.74,0.24,0.02
Destruction of tropical forests,5.43,0.08,0.67,0.35,0.12
Nuclear energy,4.12,0.10,0.15,0.87,0.09
Air pollution from toxic chemicals,5.14,0.08,0.47,0.74,0.06
The ozone hole in the upper atmosphere,4.78,0.08,0.41,0.71,0.17
The use of aerosol spray cans,4.39,0.08,0.49,0.64,0.20
"Other natural causes (e.g., fluctuations in the sun, changes in the Earth’s axis, the Earth’s magnetic field, etc.)",4.36,0.08,-0.02,0.09,0.90
Volcanic eruptions,4.10,0.08,0.23,0.15,0.86
